{
  "$schema": "https://json-schema.org/draft/2020-12/schema",
  "$id": "https://formal-conjectures.github.io/schemas/formal-conjectures.pr-audit-observation.v1.schema.json",
  "title": "Formal Conjectures pull-request audit observation v1",
  "description": "A timestamped mutable status envelope that points to an immutable audit core.",
  "type": "object",
  "additionalProperties": false,
  "required": ["schema_version", "generator", "core", "inputs", "observed_at", "source", "pull_request", "root"],
  "properties": {
    "schema_version": {"const": "formal-conjectures.pr-audit-observation.v1"},
    "generator": {"$ref": "formal-conjectures.pr-audit.v1.schema.json#/$defs/generator"},
    "core": {
      "type": "object",
      "additionalProperties": false,
      "required": ["root", "sha256"],
      "properties": {
        "root": {"$ref": "#/$defs/sha256"},
        "sha256": {"$ref": "#/$defs/sha256"}
      }
    },
    "inputs": {
      "type": "object",
      "additionalProperties": false,
      "required": ["manifest_sha256", "artifact_root", "artifacts", "generator_artifact_id", "observation_artifact_id", "receipt_artifact_id", "query_artifact_id", "provenance_artifact_ids"],
      "properties": {
        "manifest_sha256": {"$ref": "#/$defs/sha256"},
        "artifact_root": {"$ref": "#/$defs/sha256"},
        "artifacts": {
          "type": "array",
          "minItems": 4,
          "items": {"$ref": "formal-conjectures.pr-audit.v1.schema.json#/$defs/artifact"}
        },
        "generator_artifact_id": {"$ref": "formal-conjectures.pr-audit.v1.schema.json#/$defs/identifier"},
        "observation_artifact_id": {"$ref": "formal-conjectures.pr-audit.v1.schema.json#/$defs/identifier"},
        "receipt_artifact_id": {"$ref": "formal-conjectures.pr-audit.v1.schema.json#/$defs/identifier"},
        "query_artifact_id": {"$ref": "formal-conjectures.pr-audit.v1.schema.json#/$defs/identifier"},
        "provenance_artifact_ids": {
          "type": "array",
          "uniqueItems": true,
          "items": {"$ref": "formal-conjectures.pr-audit.v1.schema.json#/$defs/identifier"}
        }
      }
    },
    "observed_at": {"$ref": "#/$defs/timestamp"},
    "source": {
      "type": "object",
      "additionalProperties": false,
      "required": ["authority", "artifact_id", "sha256", "endpoint", "operation_name", "query_sha256", "receipt_sha256", "receipt", "acquired_at", "http_status", "request_id", "limitations"],
      "properties": {
        "authority": {"const": "github_graphql"},
        "artifact_id": {"$ref": "formal-conjectures.pr-audit.v1.schema.json#/$defs/identifier"},
        "sha256": {"$ref": "#/$defs/sha256"},
        "endpoint": {"const": "https://api.github.com/graphql"},
        "operation_name": {"const": "PullRequestAuditObservation"},
        "query_sha256": {"$ref": "#/$defs/sha256"},
        "receipt_sha256": {"$ref": "#/$defs/sha256"},
        "receipt": {"$ref": "#/$defs/receipt"},
        "acquired_at": {"$ref": "#/$defs/timestamp"},
        "http_status": {"const": 200},
        "request_id": {"type": "string", "minLength": 1},
        "limitations": {"type": "array", "items": {"type": "string", "minLength": 1}}
      }
    },
    "pull_request": {
      "type": "object",
      "additionalProperties": false,
      "required": ["number", "url", "state", "is_draft", "merge_state_status", "review_decision", "updated_at", "base_commit_oid", "head_commit_oid", "reviews"],
      "properties": {
        "number": {"type": "integer", "minimum": 1},
        "url": {"type": "string", "format": "uri", "pattern": "^https://"},
        "state": {"enum": ["OPEN", "CLOSED", "MERGED"]},
        "is_draft": {"type": "boolean"},
        "merge_state_status": {"enum": ["BEHIND", "BLOCKED", "CLEAN", "DIRTY", "DRAFT", "HAS_HOOKS", "UNKNOWN", "UNSTABLE"]},
        "review_decision": {"oneOf": [{"enum": ["APPROVED", "CHANGES_REQUESTED", "REVIEW_REQUIRED"]}, {"type": "null"}]},
        "updated_at": {"$ref": "#/$defs/timestamp"},
        "base_commit_oid": {"$ref": "#/$defs/oid"},
        "head_commit_oid": {"$ref": "#/$defs/oid"},
        "reviews": {"type": "array", "items": {"$ref": "#/$defs/review"}}
      }
    },
    "root": {"$ref": "#/$defs/sha256"}
  },
  "$defs": {
    "sha256": {"type": "string", "pattern": "^sha256:[0-9a-f]{64}$"},
    "oid": {"type": "string", "pattern": "^[0-9a-f]{40}$"},
    "timestamp": {
      "type": "string",
      "pattern": "^\\d{4}-\\d{2}-\\d{2}T\\d{2}:\\d{2}:\\d{2}(?:\\.\\d+)?(?:Z|[+-]\\d{2}:\\d{2})$"
    },
    "review": {
      "type": "object",
      "additionalProperties": false,
      "required": ["id", "author", "state", "submitted_at", "commit_oid"],
      "properties": {
        "id": {"type": "string", "minLength": 1},
        "author": {"type": "string", "minLength": 1},
        "state": {"enum": ["APPROVED", "CHANGES_REQUESTED", "COMMENTED", "DISMISSED", "PENDING"]},
        "submitted_at": {"$ref": "#/$defs/timestamp"},
        "commit_oid": {"$ref": "#/$defs/oid"}
      }
    },
    "receipt": {
      "type": "object",
      "additionalProperties": false,
      "required": ["schema_version", "transport", "endpoint", "operation_name", "variables", "acquired_at", "response_sha256", "query_sha256", "http_status", "request_id", "limitations"],
      "properties": {
        "schema_version": {"const": "formal-conjectures.pr-audit-acquisition-receipt.v1"},
        "transport": {"const": "https"},
        "endpoint": {"const": "https://api.github.com/graphql"},
        "operation_name": {"const": "PullRequestAuditObservation"},
        "variables": {
          "type": "object",
          "additionalProperties": false,
          "required": ["owner", "name", "number"],
          "properties": {
            "owner": {"type": "string", "minLength": 1},
            "name": {"type": "string", "minLength": 1},
            "number": {"type": "integer", "minimum": 1}
          }
        },
        "acquired_at": {"$ref": "#/$defs/timestamp"},
        "response_sha256": {"$ref": "#/$defs/sha256"},
        "query_sha256": {"$ref": "#/$defs/sha256"},
        "http_status": {"const": 200},
        "request_id": {"type": "string", "minLength": 1},
        "limitations": {"type": "array", "minItems": 1, "items": {"type": "string", "minLength": 1}}
      }
    }
  }
}
