{"core":{"root":"sha256:c3601c5a4b4aeb49fdc726b99c56820470f5306e41a256fa54f61c5739ce2dd9","sha256":"sha256:f153580357bc98b7f3c80f211993ec1d9aede65bb68b641d03773a98bc0b1710"},"generator":{"canonicalization":"fc-jcs-ijson-integer-v1","name":"formal-conjectures-pr-audit","noncapabilities":["git","github","lean","model","network","subprocess"],"schema_version":"formal-conjectures.pr-audit-generator.v1","source":{"baseline":{"commit_oid":"c9052e8577118ed0ada54462bd4ef1f3beff37d6","tree_oid":"864ee77ee26a7cbd85b30558f8d9d2036f8717ed"},"kind":"git_baseline_with_content_addressed_overlay","overlay":{"files":[{"path":"audit/pr-audit-v1/schemas/formal-conjectures.pr-audit-observation.v1.schema.json","sha256":"sha256:cb5171ac52f75a54aaf1659a0388daa61c27e91b2a77ffcd0eadcd86a6c7ae36"},{"path":"audit/pr-audit-v1/schemas/formal-conjectures.pr-audit.v1.schema.json","sha256":"sha256:b581b8970673fe90b749a54a0b2df9f0ea5d6221f90f49f67f2f03602b2efc45"},{"path":"scripts/generate_pr_audit.py","sha256":"sha256:ebe7961418cd37b0816db4bf72628962f36f88cb1fd4d4f9cb4c102d5b0ae070"},{"path":"scripts/pr_audit.py","sha256":"sha256:d00075ad2cd7df8199279e498bc93840d2f248a63ec0e5415a565b657a6b3f7e"}],"root":"sha256:3d00bb78dde7a9ee1d172e083e379b80f74b792b88e2986b4984af12acd34454"},"repository":"https://github.com/google-deepmind/formal-conjectures"},"version":"1.0.0"},"inputs":{"artifact_root":"sha256:e2f979c862562b1b925c887e1599ac80867aa6351a39227a7db567fb2f92da2f","artifacts":[{"id":"generator","media_type":"application/json","path":"inputs/generator.json","role":"generator_identity","sha256":"sha256:b27323ec4196bb837fc9c3882a5e45ca84f577f056e15e4d0298e2538e14ba17"},{"id":"github-observation","media_type":"application/vnd.github+json","path":"inputs/github-graphql-response.json","role":"authoritative_observation","sha256":"sha256:ebdd3d3cc608a3b78fcd883b45233ac069895a02ee1a89a5fdc0dc54f85b59d5"},{"id":"github-query","media_type":"text/plain","path":"inputs/github-graphql-query.graphql","role":"query","sha256":"sha256:a503785e3ae47f873c60e26767d662f2583d60103cf43305db05ef0f5c5a4328"},{"id":"github-receipt","media_type":"application/json","path":"inputs/github-acquisition-receipt.json","role":"acquisition_receipt","sha256":"sha256:4a1180e331c08d0dc87bc0116de92e94f0406b6d7fc3f0b467587e500edaff29"},{"id":"provenance-core-acquisition-receipt","media_type":"application/json","path":"inputs/github-core-acquisition-receipt.json","role":"provenance_event","sha256":"sha256:4c1bf123e775d7b192b165c9ede46d93e26916a8cdb67860c2fadfcf9c477871"},{"id":"provenance-core-snapshot-response","media_type":"application/vnd.github+json","path":"inputs/github-core-snapshot-response.json","role":"provenance_event","sha256":"sha256:c114fca4c1da542f30dbdbad17dfcafd22516311b632c1ccf9e11305fcbb0b80"},{"id":"provenance-job-acquisition","media_type":"application/json","path":"inputs/github-job-acquisition-receipt.json","role":"provenance_event","sha256":"sha256:6c4a40e599910e3367a48e3bb938ad026e9c69708c5825b2dbfb8f1bcb4b3205"},{"id":"provenance-job-response","media_type":"application/vnd.github+json","path":"inputs/github-job-response.json","role":"provenance_event","sha256":"sha256:0ca2b29c056093cc0a36a126f9f07016cf03fd39a310025ec45e138b50f77d74"},{"id":"provenance-review-guide-acquisition","media_type":"application/json","path":"inputs/review-guide.acquisition-receipt.json","role":"provenance_event","sha256":"sha256:de3559a41ce955d2c91961ac295819757e2d1cfac223e4458343825ffba04628"},{"id":"provenance-semantic-review-preparation","media_type":"application/json","path":"inputs/review-observation.json","role":"provenance_event","sha256":"sha256:5cd5edfacc2e51b728e49c8ee9875e630cb02c7cc53c42965caa5b272da69917"},{"id":"provenance-workflow-acquisition","media_type":"application/json","path":"inputs/method-build-and-docs.acquisition-receipt.json","role":"provenance_event","sha256":"sha256:f8da310336fba7d4147e5700a67f0faffa9d40baff7d5c2aa1fddb2364871ec3"}],"generator_artifact_id":"generator","manifest_sha256":"sha256:0a06ce580baf4c670ccd7268a89552005b4eab4f205dfcf197db4b365eb1811a","observation_artifact_id":"github-observation","provenance_artifact_ids":["provenance-core-acquisition-receipt","provenance-core-snapshot-response","provenance-job-acquisition","provenance-job-response","provenance-review-guide-acquisition","provenance-semantic-review-preparation","provenance-workflow-acquisition"],"query_artifact_id":"github-query","receipt_artifact_id":"github-receipt"},"observed_at":"2026-08-12T20:25:21Z","pull_request":{"base_commit_oid":"a91ab6df34970fdd0fd8c919e693b2ba81fa4fbb","head_commit_oid":"288608562e684a2f3c97ba0ce960a2649a71370b","is_draft":false,"merge_state_status":"UNKNOWN","number":1237,"review_decision":"APPROVED","reviews":[{"author":"smmercuri","commit_oid":"b99a00bff3e76a112e3a00458c376acaaf1b4392","id":"PRR_kwDOOogmB87P5dwU","state":"CHANGES_REQUESTED","submitted_at":"2025-11-20T13:50:54Z"},{"author":"smmercuri","commit_oid":"b99a00bff3e76a112e3a00458c376acaaf1b4392","id":"PRR_kwDOOogmB87Qeusx","state":"CHANGES_REQUESTED","submitted_at":"2025-11-23T12:29:13Z"},{"author":"AlexBrodbelt","commit_oid":"b99a00bff3e76a112e3a00458c376acaaf1b4392","id":"PRR_kwDOOogmB87RUSCe","state":"COMMENTED","submitted_at":"2025-11-26T16:23:31Z"},{"author":"smmercuri","commit_oid":"c12b147ae907ac937b37e04fdb673df13379163b","id":"PRR_kwDOOogmB87RusrX","state":"CHANGES_REQUESTED","submitted_at":"2025-11-28T12:12:49Z"},{"author":"AlexBrodbelt","commit_oid":"c12b147ae907ac937b37e04fdb673df13379163b","id":"PRR_kwDOOogmB87Y71tX","state":"COMMENTED","submitted_at":"2026-01-08T14:01:38Z"},{"author":"AlexBrodbelt","commit_oid":"c12b147ae907ac937b37e04fdb673df13379163b","id":"PRR_kwDOOogmB87Y77Gg","state":"COMMENTED","submitted_at":"2026-01-08T14:06:33Z"},{"author":"smmercuri","commit_oid":"c86f22dcbdd107aa90b97335e9e9674033fcfb88","id":"PRR_kwDOOogmB87Z7dqF","state":"CHANGES_REQUESTED","submitted_at":"2026-01-13T15:16:34Z"},{"author":"AlexBrodbelt","commit_oid":"c86f22dcbdd107aa90b97335e9e9674033fcfb88","id":"PRR_kwDOOogmB87Z9oI-","state":"COMMENTED","submitted_at":"2026-01-13T16:45:24Z"},{"author":"smmercuri","commit_oid":"288608562e684a2f3c97ba0ce960a2649a71370b","id":"PRR_kwDOOogmB87Z-IWr","state":"APPROVED","submitted_at":"2026-01-13T17:14:06Z"}],"state":"MERGED","updated_at":"2026-01-13T20:56:02Z","url":"https://github.com/google-deepmind/formal-conjectures/pull/1237"},"root":"sha256:4c5e4da63c7b30d6b5615f5a6d17d9844f066f7fca2da17064f09de44b7f1e62","schema_version":"formal-conjectures.pr-audit-observation.v1","source":{"acquired_at":"2026-08-12T20:25:21Z","artifact_id":"github-observation","authority":"github_graphql","endpoint":"https://api.github.com/graphql","http_status":200,"limitations":["The receipt records public GitHub response headers and bytes; it is not a cryptographic GitHub signature."],"operation_name":"PullRequestAuditObservation","query_sha256":"sha256:a503785e3ae47f873c60e26767d662f2583d60103cf43305db05ef0f5c5a4328","receipt":{"acquired_at":"2026-08-12T20:25:21Z","endpoint":"https://api.github.com/graphql","http_status":200,"limitations":["The receipt records public GitHub response headers and bytes; it is not a cryptographic GitHub signature."],"operation_name":"PullRequestAuditObservation","query_sha256":"sha256:a503785e3ae47f873c60e26767d662f2583d60103cf43305db05ef0f5c5a4328","request_id":"DCB0:F4954:1718059:4EB15DF:6A7CD6B0","response_sha256":"sha256:ebdd3d3cc608a3b78fcd883b45233ac069895a02ee1a89a5fdc0dc54f85b59d5","schema_version":"formal-conjectures.pr-audit-acquisition-receipt.v1","transport":"https","variables":{"name":"formal-conjectures","number":1237,"owner":"google-deepmind"}},"receipt_sha256":"sha256:4a1180e331c08d0dc87bc0116de92e94f0406b6d7fc3f0b467587e500edaff29","request_id":"DCB0:F4954:1718059:4EB15DF:6A7CD6B0","sha256":"sha256:ebdd3d3cc608a3b78fcd883b45233ac069895a02ee1a89a5fdc0dc54f85b59d5"}}
