{"core":{"root":"sha256:cbda065d08add14c32835e504481138ea197cacee44a9f7ac09841c2cb6cf3b1","sha256":"sha256:c8c83742bd7e3fcffa410af8b0f5a4cc78436f1a745ae6c2df3249ee3dced513"},"generator":{"canonicalization":"fc-jcs-ijson-integer-v1","name":"formal-conjectures-pr-audit","noncapabilities":["git","github","lean","model","network","subprocess"],"schema_version":"formal-conjectures.pr-audit-generator.v1","source":{"baseline":{"commit_oid":"c9052e8577118ed0ada54462bd4ef1f3beff37d6","tree_oid":"864ee77ee26a7cbd85b30558f8d9d2036f8717ed"},"kind":"git_baseline_with_content_addressed_overlay","overlay":{"files":[{"path":"audit/pr-audit-v1/schemas/formal-conjectures.pr-audit-observation.v1.schema.json","sha256":"sha256:cb5171ac52f75a54aaf1659a0388daa61c27e91b2a77ffcd0eadcd86a6c7ae36"},{"path":"audit/pr-audit-v1/schemas/formal-conjectures.pr-audit.v1.schema.json","sha256":"sha256:b581b8970673fe90b749a54a0b2df9f0ea5d6221f90f49f67f2f03602b2efc45"},{"path":"scripts/generate_pr_audit.py","sha256":"sha256:ebe7961418cd37b0816db4bf72628962f36f88cb1fd4d4f9cb4c102d5b0ae070"},{"path":"scripts/pr_audit.py","sha256":"sha256:d00075ad2cd7df8199279e498bc93840d2f248a63ec0e5415a565b657a6b3f7e"}],"root":"sha256:3d00bb78dde7a9ee1d172e083e379b80f74b792b88e2986b4984af12acd34454"},"repository":"https://github.com/google-deepmind/formal-conjectures"},"version":"1.0.0"},"inputs":{"artifact_root":"sha256:f2ae2e88d808b8faed0bc05f7a8736b164cc6acf8430517ae7109a01eed40005","artifacts":[{"id":"generator","media_type":"application/json","path":"inputs/generator.json","role":"generator_identity","sha256":"sha256:b27323ec4196bb837fc9c3882a5e45ca84f577f056e15e4d0298e2538e14ba17"},{"id":"github-observation","media_type":"application/vnd.github+json","path":"inputs/github-graphql-response.json","role":"authoritative_observation","sha256":"sha256:799dfbdba1889ed76cd7b3d43b20ee4e9902c0c9e3250ab6336ca58805d73bae"},{"id":"github-query","media_type":"text/plain","path":"inputs/github-graphql-query.graphql","role":"query","sha256":"sha256:a503785e3ae47f873c60e26767d662f2583d60103cf43305db05ef0f5c5a4328"},{"id":"github-receipt","media_type":"application/json","path":"inputs/github-acquisition-receipt.json","role":"acquisition_receipt","sha256":"sha256:25ad6d41b3d0ac4b60cbad66177c7844bc316e8338c1472cb3d9fdedaeb6438f"},{"id":"provenance-comparator-preparation","media_type":"application/json","path":"inputs/comparator-packet-preparation-event.json","role":"provenance_event","sha256":"sha256:84e7aca660463b251a79bf0b2741113dada663fda2eda30684a1008d368c4ce7"},{"id":"provenance-core-acquisition-receipt","media_type":"application/json","path":"inputs/github-core-acquisition-receipt.json","role":"provenance_event","sha256":"sha256:b90cb8432c950c07a4bade1c43593667602a464ded63bbc2500000aa9b048033"},{"id":"provenance-core-snapshot-response","media_type":"application/vnd.github+json","path":"inputs/github-core-snapshot-response.json","role":"provenance_event","sha256":"sha256:d6d32d696ffce1e773b0193fd230335b91110b4503ed8936119f27d536e16e00"},{"id":"provenance-job-acquisition","media_type":"application/json","path":"inputs/github-job-acquisition-receipt.json","role":"provenance_event","sha256":"sha256:148bba1a6a6e9a1fd40c5f296de05fae2c4f9822ea01c81896ff4ecd3efb3233"},{"id":"provenance-job-response","media_type":"application/vnd.github+json","path":"inputs/github-job-response.json","role":"provenance_event","sha256":"sha256:fcfa037a6c831ec4b3a0c08a859081488ef3d27dafc25a2423938485fc1c0225"},{"id":"provenance-workflow-acquisition","media_type":"application/json","path":"inputs/method-build-and-docs.acquisition-receipt.json","role":"provenance_event","sha256":"sha256:d7b21cc1ab244597d75ea75d2333f2d9420a3f49fe877c448618a0b3c3eb2c6c"}],"generator_artifact_id":"generator","manifest_sha256":"sha256:a0ec96617c797d1fbed4776285740ee4125d4d2097a70ea841f239af296b31ac","observation_artifact_id":"github-observation","provenance_artifact_ids":["provenance-comparator-preparation","provenance-core-acquisition-receipt","provenance-core-snapshot-response","provenance-job-acquisition","provenance-job-response","provenance-workflow-acquisition"],"query_artifact_id":"github-query","receipt_artifact_id":"github-receipt"},"observed_at":"2026-08-12T20:25:24Z","pull_request":{"base_commit_oid":"99ae49df4b27d9d95877c562ab9e1fd9b7ff1dc7","head_commit_oid":"868cc092aeb713dbf8027883c5fa575e550cfae9","is_draft":false,"merge_state_status":"UNKNOWN","number":3959,"review_decision":"APPROVED","reviews":[{"author":"jcreedcmu","commit_oid":"30c63898f32c0c7d05a6830504195d7f896451f0","id":"PRR_kwDOOogmB879jZVh","state":"COMMENTED","submitted_at":"2026-05-08T17:03:18Z"},{"author":"dwrensha","commit_oid":"30c63898f32c0c7d05a6830504195d7f896451f0","id":"PRR_kwDOOogmB879kIEO","state":"COMMENTED","submitted_at":"2026-05-08T17:30:41Z"},{"author":"Paul-Lez","commit_oid":"30c63898f32c0c7d05a6830504195d7f896451f0","id":"PRR_kwDOOogmB879wy6I","state":"COMMENTED","submitted_at":"2026-05-09T08:29:33Z"},{"author":"Paul-Lez","commit_oid":"30c63898f32c0c7d05a6830504195d7f896451f0","id":"PRR_kwDOOogmB879wy92","state":"APPROVED","submitted_at":"2026-05-09T08:29:49Z"},{"author":"dwrensha","commit_oid":"30c63898f32c0c7d05a6830504195d7f896451f0","id":"PRR_kwDOOogmB879xzi6","state":"COMMENTED","submitted_at":"2026-05-09T11:17:06Z"}],"state":"MERGED","updated_at":"2026-05-09T23:30:38Z","url":"https://github.com/google-deepmind/formal-conjectures/pull/3959"},"root":"sha256:93d980b05b0906cd8173a5a2525521cb3ceaebf70c9db4eba827ccbbb5f6652d","schema_version":"formal-conjectures.pr-audit-observation.v1","source":{"acquired_at":"2026-08-12T20:25:24Z","artifact_id":"github-observation","authority":"github_graphql","endpoint":"https://api.github.com/graphql","http_status":200,"limitations":["The receipt records public GitHub response headers and bytes; it is not a cryptographic GitHub signature."],"operation_name":"PullRequestAuditObservation","query_sha256":"sha256:a503785e3ae47f873c60e26767d662f2583d60103cf43305db05ef0f5c5a4328","receipt":{"acquired_at":"2026-08-12T20:25:24Z","endpoint":"https://api.github.com/graphql","http_status":200,"limitations":["The receipt records public GitHub response headers and bytes; it is not a cryptographic GitHub signature."],"operation_name":"PullRequestAuditObservation","query_sha256":"sha256:a503785e3ae47f873c60e26767d662f2583d60103cf43305db05ef0f5c5a4328","request_id":"BB68:146BF1:14E3716:479FD03:6A7CD6B3","response_sha256":"sha256:799dfbdba1889ed76cd7b3d43b20ee4e9902c0c9e3250ab6336ca58805d73bae","schema_version":"formal-conjectures.pr-audit-acquisition-receipt.v1","transport":"https","variables":{"name":"formal-conjectures","number":3959,"owner":"google-deepmind"}},"receipt_sha256":"sha256:25ad6d41b3d0ac4b60cbad66177c7844bc316e8338c1472cb3d9fdedaeb6438f","request_id":"BB68:146BF1:14E3716:479FD03:6A7CD6B3","sha256":"sha256:799dfbdba1889ed76cd7b3d43b20ee4e9902c0c9e3250ab6336ca58805d73bae"}}
